{
  "$schema": "https://json-schema.org/draft/2020-12/schema",
  "$id": "contratos/whatsapp-closer-agent/entrada/1.json",
  "title": "Entrada del Cerrador de WhatsApp",
  "description": "Un mensaje entrante de WhatsApp, más el catálogo, la disponibilidad y el playbook de objeciones que el agente necesita para contestarlo.",
  "type": "object",
  "additionalProperties": false,
  "required": ["version", "mensaje", "playbook"],
  "properties": {
    "version": {
      "const": "1",
      "description": "Fijo. Sin esto no se sabe contra qué versión del contrato te están hablando."
    },
    "mensaje": {
      "type": "object",
      "additionalProperties": false,
      "required": ["tipo"],
      "anyOf": [
        { "required": ["de"] },
        { "required": ["contacto_id"] }
      ],
      "description": "Lo que llegó por el webhook, ya desenvuelto, más las dos cosas que el paso 1 resuelve y deja escritas acá: `media_local` y `horario_elegido`. Tiene que traer `de` o `contacto_id`; con ninguno de los dos no hay a quién contestarle.",
      "properties": {
        "de": {
          "type": ["string", "null"],
          "description": "Número del contacto en formato internacional, sin espacios ni signos. Puede venir nulo: desde abril de 2026 alguien con nombre de usuario de WhatsApp le escribe a un negocio sin exponer su teléfono. Ahí la identidad es `contacto_id`."
        },
        "contacto_id": {
          "type": ["string", "null"],
          "description": "Identificador estable del contacto para este negocio, el `businessScopedUserId`. Es el ancla de identidad: el número puede faltar o cambiar, esto no. Todo lo que se guarda se indexa por acá."
        },
        "tipo": {
          "enum": ["texto", "audio", "imagen"],
          "description": "El audio se transcribe en el paso 1 y la imagen se describe. Sin la credencial que hace falta, el ciclo se detiene con el motivo en vez de adivinar el contenido."
        },
        "texto": {
          "type": ["string", "null"],
          "description": "Nulo cuando el tipo es audio o imagen y todavía no se transcribió."
        },
        "media_id": {
          "type": ["string", "null"],
          "description": "Identificador del medio en el proveedor. Se baja con la credencial puesta —no es un enlace público— y se baja al recibirlo: cuando Meta lo suelta, no se recupera más. Nunca se le pasa a una API de visión: sin cabecera devuelve 401."
        },
        "media_url": {
          "type": ["string", "null"],
          "description": "Enlace temporal, cuando el proveedor da uno. Caduca. Zernio no da ninguno y en ese caso viene nulo: la vía es `media_id`."
        },
        "media_local": {
          "type": ["string", "null"],
          "description": "Ruta del archivo ya bajado. La escribe el paso 1 después de traerlo. Nula mientras no se haya bajado, y si la bajada falló el paso queda `fallado` con el motivo."
        },
        "recibido_en": {
          "type": ["string", "null"],
          "format": "date-time",
          "description": "Cuándo llegó el mensaje. Es el extremo desde el que se cuenta la ventana de 24 horas —cierra 24 horas después de esto— y no es «ahora»: contra qué instante se compara lo decide el reloj del ciclo, que es el de la máquina y se lee una sola vez al empezar. Ver blueprint/40-pruebas.md paso 2. Los dos son distintos cuando el ciclo se retoma a mano desde la etapa del CRM, o cuando el proveedor entrega tarde: ahí la ventana puede estar cerrada aunque este campo diga otra cosa, y pasada esa ventana WhatsApp solo deja mandar plantillas aprobadas."
        },
        "horario_elegido": {
          "type": ["string", "null"],
          "format": "date-time",
          "description": "El horario que el contacto aceptó, escrito igual que el `inicio` de `disponibilidad` del que salió. Nulo mientras nadie eligió, que es lo normal en el primer mensaje. Lo escribe el paso 1 después de leer el mensaje, igual que `media_local`: cruza la respuesta del contacto contra los horarios que el turno anterior ofreció, y no interpreta fechas sueltas. También lo escribe la bandeja cuando quien opera elige uno y aprueba el borrador del paso 4. Sin esto el paso 4 no tiene qué agendar y queda `sin-confirmar` con el motivo «no hay horario elegido»; con un valor que no esté en `disponibilidad`, queda `fallado` y tampoco agenda. Es el segundo requisito del paso 4 y no reemplaza al primero: la confirmación explícita sigue siendo obligatoria. Ver `blueprint/33-agenda.md` paso 3."
        }
      }
    },
    "modo": {
      "enum": ["borrador", "automatico"],
      "default": "borrador",
      "description": "En `borrador` los pasos 3, 4 y 5 muestran lo que van a hacer y esperan confirmación explícita. Es el default y lo cambia quien instala, nunca el agente. Ver S01 en SUPUESTOS.md"
    },
    "confirmado": {
      "type": "boolean",
      "default": false,
      "description": "La confirmación explícita de esta llamada. Llamar a un paso destructivo con esto en falso es exactamente lo que prueban las aserciones 3, 4 y 5."
    },
    "playbook": {
      "type": "object",
      "additionalProperties": false,
      "required": ["objeciones"],
      "description": "La estrategia de cierre. Lo escribe quien vende, o lo saca el kit del documento que subiste, o sale de la entrevista. Es lo que separa este agente de un bot de menú. Ver S02 en SUPUESTOS.md",
      "properties": {
        "objeciones": {
          "type": "array",
          "minItems": 1,
          "description": "Una objeción por elemento, con la respuesta que se da. Si la objeción del contacto no está acá, el agente la nombra y no la improvisa.",
          "items": {
            "type": "object",
            "additionalProperties": false,
            "required": ["objecion", "respuesta"],
            "properties": {
              "objecion": { "type": "string" },
              "respuesta": { "type": "string" }
            }
          }
        },
        "tono": {
          "type": ["string", "null"],
          "description": "Cómo habla la marca, en dos o tres líneas. Sin esto el agente usa el registro neutro."
        }
      }
    },
    "catalogo": {
      "type": "array",
      "description": "Lo que se vende, con precio. Un precio que no está acá no existe: el agente no lo inventa.",
      "items": {
        "type": "object",
        "additionalProperties": false,
        "required": ["nombre", "precio"],
        "properties": {
          "nombre": { "type": "string" },
          "precio": { "type": "number" },
          "moneda": { "type": "string" }
        }
      }
    },
    "rango_precio": {
      "type": ["object", "null"],
      "additionalProperties": false,
      "description": "Fuera de este rango el paso 6 escala. Nulo desactiva ese disparador y deja solo el enojo y las palabras clave.",
      "properties": {
        "minimo": { "type": "number" },
        "maximo": { "type": "number" }
      }
    },
    "disponibilidad": {
      "type": "array",
      "description": "Horarios libres reales. El paso 3 ofrece tres de acá y ninguno inventado, y el paso 4 agenda el de `mensaje.horario_elegido`, que tiene que ser uno de éstos. La duración de la cita sale del `duracion_min` del que se eligió.",
      "items": {
        "type": "object",
        "additionalProperties": false,
        "required": ["inicio"],
        "properties": {
          "inicio": { "type": "string", "format": "date-time" },
          "duracion_min": { "type": "integer", "default": 30 }
        }
      }
    },
    "opciones_horario": {
      "type": "integer",
      "minimum": 1,
      "maximum": 5,
      "default": 3,
      "description": "Cuántos horarios ofrece el paso 3, dentro de los próximos 5 días hábiles. Salen de `disponibilidad` y de ningún otro lado. Ver S04 en SUPUESTOS.md"
    },
    "umbrales": {
      "type": "object",
      "additionalProperties": false,
      "description": "Los cortes del score de 0 a 100: caliente desde `caliente`, tibio desde `tibio`, frío abajo. Ver S03 en SUPUESTOS.md",
      "properties": {
        "caliente": { "type": "integer", "default": 70 },
        "tibio": { "type": "integer", "default": 40 }
      }
    },
    "palabras_escalacion": {
      "type": "array",
      "items": { "type": "string" },
      "default": ["humano", "persona real", "reclamo", "abogado", "estafa", "cancelar"],
      "description": "Cualquiera de estas en el mensaje dispara el paso 6. La lista de arriba es el default; se reemplaza con la tuya. Ver S08 en SUPUESTOS.md"
    },
    "canal_interno": {
      "type": ["string", "null"],
      "description": "Dónde avisa el paso 6. Un canal de Slack, o un número interno de WhatsApp si no hay Slack."
    }
  }
}
